<!ELEMENT romdb (rom)+>
<!ELEMENT rom (md5+,romtype)>
<!ATTLIST rom
              id CDATA #IMPLIED>
<!ELEMENT md5 (#PCDATA)>
<!ELEMENT romtype (#PCDATA)>
